{"artifact_kind":"handoff_index","bundle_content_hash":"sha256:dae87bee216021cf285b80a06f62b9c19614d1100489c46d2296a4eebef8d1e7","cases":[{"case_id":"f1-ccc","horizon":20,"model":"capex_credit_cycle","path":"artifacts/f1-ccc.json","purpose":"F1 の primary セル（partial）。GDP 成長率 assumption はどのモデルも受け取らず開示のみ（G-03）。","scenario_id":"jf-f1-base","sha256":"sha256:5fb4c1dbf3ec09c90417c71f7741ff90b9a661e618983888dc18ece44dc188d6","summary":{"adoption":"primary","artifact_content_hash":"sha256:7b963763b53ad0cd94e6b8dd300548bc83b60f124a2d0639640c99ea3705af20","artifact_kind":"result","claim_level":"direction_and_relative_timing","direction":{"consumption":"none","employment":"none","investment":"down","output":"up","private_borrowing_cost":"up","private_debt":"none"},"explicit_concepts":["growth_path","policy_rate","long_rate_funding_condition"],"explicit_not_accepted_concepts":["growth_path"],"family":"low_growth_high_rates","family_complete":false,"fre_context_identity":"sha256:29a8061e151be188076a455586fe85618fa232a5ed2e9a9148cd12d1c181705e","has_funding_cost_legs":false,"has_timing_diagnostics":true,"held_at_baseline_concepts":[],"model":"capex_credit_cycle","n_periods":20,"numeric_semantics":"normalized_deviation","representability":"partial","result_shape":"time_path","scenario_id":"jf-f1-base","uncovered_channels":["growth_assumption_transmission","term_structure","sovereign_debt_dynamics"],"unsupported_concepts":["growth_path"],"unsupported_outputs":[],"variables":["consumption","employment","investment","output","private_borrowing_cost","private_debt"],"warning_count":2},"tags":["explicit_assumption_not_accepted","partial"]},{"case_id":"f1-nk","horizon":20,"model":"new_keynesian","path":"artifacts/f1-nk.json","purpose":"F1 の supporting セル（partial）。長期金利を受け取らず、未指定のインフレ目標は baseline のまま。","scenario_id":"jf-f1-base","sha256":"sha256:32530fe35c452af9e099ec4beb8de5a981422f18dc8c26bcfe5c75541941f567","summary":{"adoption":"supporting","artifact_content_hash":"sha256:aa5f68e6424973a3274bdff5d93fbac4eae8233c6869d59a6e8c03983c9f5364","artifact_kind":"result","claim_level":"direction_and_relative_timing","direction":{"inflation":"down","nominal_rate":"up","output_gap":"down","real_rate":"up"},"explicit_concepts":["growth_path","policy_rate","long_rate_funding_condition"],"explicit_not_accepted_concepts":["growth_path","long_rate_funding_condition"],"family":"low_growth_high_rates","family_complete":false,"fre_context_identity":"sha256:29a8061e151be188076a455586fe85618fa232a5ed2e9a9148cd12d1c181705e","has_funding_cost_legs":false,"has_timing_diagnostics":true,"held_at_baseline_concepts":["inflation"],"model":"new_keynesian","n_periods":20,"numeric_semantics":"normalized_deviation","representability":"partial","result_shape":"time_path","scenario_id":"jf-f1-base","uncovered_channels":["growth_assumption_transmission","long_rate_funding_transmission","term_structure","sovereign_debt_dynamics"],"unsupported_concepts":["growth_path","long_rate_funding_condition"],"unsupported_outputs":["output","private_borrowing_cost"],"variables":["inflation","nominal_rate","output_gap","real_rate"],"warning_count":0},"tags":["explicit_assumption_not_accepted","optional_concept_held_at_baseline","partial"]},{"case_id":"f1-keen","horizon":20,"model":"keen","path":"artifacts/f1-keen.json","purpose":"F1 の supporting セル（partial・direction_only・static_point）。","scenario_id":"jf-f1-base","sha256":"sha256:a484f0953f5828c4c37eae98f429a195bfc87f3b4b96c2b950b589bcb4547319","summary":{"adoption":"supporting","artifact_content_hash":"sha256:37b4a0d562f5ac11b9c8f6b4e0666710870498e725321636fc1eed8370ce4345","artifact_kind":"result","claim_level":"direction_only","direction":{"employment":"none","private_debt":"none"},"explicit_concepts":["growth_path","policy_rate","long_rate_funding_condition"],"explicit_not_accepted_concepts":["growth_path","policy_rate"],"family":"low_growth_high_rates","family_complete":false,"fre_context_identity":"sha256:29a8061e151be188076a455586fe85618fa232a5ed2e9a9148cd12d1c181705e","has_funding_cost_legs":false,"has_timing_diagnostics":false,"held_at_baseline_concepts":[],"model":"keen","n_periods":2,"numeric_semantics":"model_unit_relative","representability":"partial","result_shape":"static_point","scenario_id":"jf-f1-base","uncovered_channels":["growth_assumption_transmission","policy_rate_transmission","term_structure","sovereign_debt_dynamics"],"unsupported_concepts":["growth_path","policy_rate"],"unsupported_outputs":["output","private_borrowing_cost"],"variables":["employment","private_debt"],"warning_count":1},"tags":["explicit_assumption_not_accepted","partial"]},{"case_id":"f1-solow-not-representable","horizon":20,"model":"solow","path":"artifacts/f1-solow-not-representable.json","purpose":"F1 の not_representable セル。モデルを実行せず拒否を返す。","scenario_id":"jf-f1-base","sha256":"sha256:124431bb15c2dbf5509fb612322647d4b0485a6d4135eaf41be1bbd3a9225af0","summary":{"adoption":"not_adopted","artifact_content_hash":"sha256:20a049b3ffb597577cc0e0c1b4e556ea7560965f2dad8a2d9c6dd99c9c7de002","artifact_kind":"rejection","claim_level":"none","concepts":[],"family":"low_growth_high_rates","family_complete":false,"fre_context_identity":"sha256:29a8061e151be188076a455586fe85618fa232a5ed2e9a9148cd12d1c181705e","model":"solow","numeric_semantics":"none","rejection_code":"not_adopted","representability":"not_representable","scenario_id":"jf-f1-base","uncovered_channels":["growth_assumption_transmission","policy_rate_transmission","long_rate_funding_transmission","term_structure","sovereign_debt_dynamics"],"unsupported_concepts":["growth_path","policy_rate","long_rate_funding_condition"],"unsupported_outputs":["output","private_borrowing_cost"]},"tags":["not_representable"]},{"case_id":"f1-ccc-missing-long-rate","horizon":20,"model":"capex_credit_cycle","path":"artifacts/f1-ccc-missing-long-rate.json","purpose":"必須概念（長期金利・funding 条件）が未指定。0 とみなして実行せず拒否する。","scenario_id":"jf-f1-missing-long-rate","sha256":"sha256:801431a71672bcbb57d98df504edd901d1968c416c7abd098385e5104feaf28b","summary":{"adoption":"primary","artifact_content_hash":"sha256:ed147ee8867854c4380a778e14d87721ffe5ec1a5459b7b5a5fb14a3bd5bfef1","artifact_kind":"rejection","claim_level":"direction_and_relative_timing","concepts":["long_rate_funding_condition"],"family":"low_growth_high_rates","family_complete":false,"fre_context_identity":"sha256:29a8061e151be188076a455586fe85618fa232a5ed2e9a9148cd12d1c181705e","model":"capex_credit_cycle","numeric_semantics":"normalized_deviation","rejection_code":"missing_required_assumption","representability":"partial","scenario_id":"jf-f1-missing-long-rate","uncovered_channels":["growth_assumption_transmission","term_structure","sovereign_debt_dynamics"],"unsupported_concepts":["growth_path"],"unsupported_outputs":[]},"tags":["missing_required_assumption"]},{"case_id":"f2-sim","horizon":20,"model":"sim","path":"artifacts/f2-sim.json","purpose":"F2 の primary セル（representable）。representable の通常ケース。","scenario_id":"jf-f2-base","sha256":"sha256:e51be99e4b990c9d7d802cbc8eceb3e8465d1bfcdb677e828490efd300e8444a","summary":{"adoption":"primary","artifact_content_hash":"sha256:c441fc56e41a9139fbb2547776cc787fba6deb46568ecb28fd86872eefd82929","artifact_kind":"result","claim_level":"direction_and_relative_timing","direction":{"consumption":"down","employment":"down","government_balance":"up","money_stock":"down","output":"down"},"explicit_concepts":["government_spending","tax"],"explicit_not_accepted_concepts":[],"family":"fiscal_consolidation","family_complete":false,"fre_context_identity":"sha256:29a8061e151be188076a455586fe85618fa232a5ed2e9a9148cd12d1c181705e","has_funding_cost_legs":false,"has_timing_diagnostics":true,"held_at_baseline_concepts":[],"model":"sim","n_periods":20,"numeric_semantics":"normalized_deviation","representability":"representable","result_shape":"time_path","scenario_id":"jf-f2-base","uncovered_channels":["debt_interest_burden","external_adjustment"],"unsupported_concepts":[],"unsupported_outputs":[],"variables":["consumption","employment","government_balance","money_stock","output"],"warning_count":0},"tags":["fre_context_variant","representable"]},{"case_id":"f2-islm","horizon":20,"model":"islm","path":"artifacts/f2-islm.json","purpose":"F2 の supporting セル（partial・direction_only・static_point）。","scenario_id":"jf-f2-base","sha256":"sha256:6e3a8306eff8d1db85a13722d840366943020396e0a9cbad04df45e5474b8ced","summary":{"adoption":"supporting","artifact_content_hash":"sha256:e8aeb6e34d07d2380530ab96bfbb4b7d356c424e2c4b9ba3e2d1a818009255e8","artifact_kind":"result","claim_level":"direction_only","direction":{"consumption":"down","investment":"up","nominal_rate":"down","output":"down"},"explicit_concepts":["government_spending","tax"],"explicit_not_accepted_concepts":[],"family":"fiscal_consolidation","family_complete":false,"fre_context_identity":"sha256:29a8061e151be188076a455586fe85618fa232a5ed2e9a9148cd12d1c181705e","has_funding_cost_legs":false,"has_timing_diagnostics":false,"held_at_baseline_concepts":[],"model":"islm","n_periods":2,"numeric_semantics":"model_unit_relative","representability":"partial","result_shape":"static_point","scenario_id":"jf-f2-base","uncovered_channels":["primary_balance_path","debt_interest_burden","external_adjustment"],"unsupported_concepts":[],"unsupported_outputs":["government_balance"],"variables":["consumption","investment","nominal_rate","output"],"warning_count":0},"tags":["partial"]},{"case_id":"f2-adas","horizon":20,"model":"adas","path":"artifacts/f2-adas.json","purpose":"F2 の supporting セル（partial・direction_only・static_point）。","scenario_id":"jf-f2-base","sha256":"sha256:576aba41617ae8a788c69991a04401d8dfea08e60c5fa246db6c526fc595f80b","summary":{"adoption":"supporting","artifact_content_hash":"sha256:9c6c958335edbb0603036909f76d8645e20176746ac3ab665a41a0b7364e47c9","artifact_kind":"result","claim_level":"direction_only","direction":{"consumption":"down","investment":"up","nominal_rate":"down","output":"d